,artist_id,artist_x,song_id,song_name,album_id,album,Like_Count,Lyric,date
41,20022492,BLACKPINK,32256901,Don't Know What To Do,20173253,BLACKPINK 2021 'THE SHOW' LIVE,[41],"[잠깐 누가 시간을 좀 멈춰봐
뭔가 크게 어긋난 걸 난 느껴
애써 어색하게 웃어보다
이젠 그런 내가 안쓰러워
아냐 괜찮다고 말하지만
Don't know what to do without you
하찮은 이곳에 홀로 남아
그려본 네 기억은 Blue
사람은 변해
왜 나만 이래
오늘처럼 예쁜 날에
어떻게 이렇게 모든 게 벅차기만 해
Don't know what to do
Don't know what to do without you
Don't know what to do without you
Don't know what to do without you
You know I
Don't know what to do
Don't know what to do
잠깐 왔다 떠난 사람들처럼
그냥 우린 아니었던 거지 뭐
혹시라도 전화가 울릴까 봐
괜한 기댈 하는 내가 미워
자꾸 똑딱 거리는 시계 소리가
유난히 거슬려
꽤나 멀쩡해 보이지만
Don't know what to do without you
이런 내 맘 거울에 들킬까 봐
그려본 내 입술은 Blue
혼자가 편해
난 그냥 그래
오늘처럼 예쁜 날에
어떻게 이렇게 모든 게 벅차기만 해
Don't know what to do
Don't know what to do without you
Don't know what to do without you
Don't know what to do without you
You know I
Don't know what to do
Don't know what to do without you
아냐 괜찮다고 말하지만
Don't know what to do without you
하찮은 이곳에 홀로 남아
그려본 네 기억은 Blue]",2021.06.11
42,20022492,BLACKPINK,32256909,휘파람,20173253,BLACKPINK 2021 'THE SHOW' LIVE,[34],"[Hey boy
Make' em whistle
Like a missile bomb bomb
Every time I show up blow up uh
Make' em whistle
Like a missile bomb bomb
Every time I show up blow up uh
넌 너무 아름다워
널 잊을 수가 없어
그 눈빛이 아직 나를
이렇게 설레게 해 Boom boom
24 365
오직 너와 같이 하고파
낮에도 이 밤에도
이렇게 너를 원해 Ooh ooh
모든 남자들이 날 매일 Check out
대부분이 날 가질 수 있다 착각
절대 많은 걸 원치 않아
맘을 원해 난
넌 심장을 도려내 보여봐
아주 씩씩하게 때론 Chic chic 하게
So hot so hot 내가 어쩔 줄 모르게 해
나지막이 불러줘
내 귓가에 도는 휘파람처럼
이대로 지나치지 마요
너도 나처럼 날 잊을 수가 없다면 WHOA
널 향한 이 마음은 Fire
내 심장이 빠르게 뛰잖아
점점 가까이 들리잖아
휘파람 UH 휘 파람 파람 파람
Can you hear that
휘 파라파라 파라 밤
휘파람 UH 휘 파람 파람 파람
Can you hear that
휘 파라파라 파라 밤
Hold up
아무 말 하지 마
Just whistle to my heart
그 소리가 지금 나를
이렇게 설레게 해 Boom boom
생각은 지루해 느낌이 Shhh
Every day all day
내 곁에만 있어줘 Zoom zoom
Uh 언제나 난 Stylin'
도도하지만 네 앞에선 Darlin'
뜨거워지잖아 Like a desert island
널 알아갈수록 울려대는 마음속
그만 내빼 넘어와라 내게 Boy
이젠 Checkmate
게임은 내가 Win uh huh
난 널 택해 안아줘 더 세게
누가 널 가로채 가기 전에 내가 Uh
이대로 지나치지 마요
너도 나처럼 날 잊을 수가 없다면 WHOA
널 향한 이 마음은 Fire
내 심장이 빠르게 뛰잖아
점점 가까이 들리잖아
휘파람 UH 휘 파람 파람 파람
Can you hear that
휘 파라파라 파라 밤
휘파람 UH 휘 파람 파람 파람
Can you hear that
휘 파라파라 파라 밤
This beat got me feelin' like
바람처럼 스쳐가는
흔한 인연이 아니길
많은 말은 필요 없어
지금 너의 곁에 나를 데려가 줘 Ohh
Make' em whistle
Like a missile bomb bomb
Every time I show up blow up uh
Make' em whistle
Like a missile bomb bomb
Every time I show up blow up uh]",2021.06.11
43,20022492,BLACKPINK,32256904,Love To Hate Me + You Never Know,20173253,BLACKPINK 2021 'THE SHOW' LIVE,[54],"[Love
How you love to hate me
Kinda sad that you always been like that
See me making waves and you don't like that
Driving through your puddles goin' splish splash
(Splish splash splish splash)
Stressing over nothing baby relax
While you gettin' angry imma kick back
Only thing I think about is big stacks
(Racks racks)
Negative days negative nights
Baby you're wasting all your time
I can't relate I keep it light
No no no drama in my life
Wake up yeah
Makeup maybe
I need you nah
I been good lately
Blowin' up
Workin' busy
You ain't worth my love
If you only love to hate me
Love l l love l l love
How you love to hate me
Love l l love l l love
You ain't worth my love
If you only love to hate me
Imma let you fade into the background
Baby all my shows are gettin' too loud
Keep on turin' it up when you want me down
Negative days negative nights
Baby you're wasting all your time
I can't relate I keep light
No no no drama in my life
Wake up yeah
Makeup maybe
I need you nah
I been good lately
Blowin' up
Workin' busy
You ain't worth my love
If you only love to hate me
Love l l love l l love
How you love to hate me
Love l l love l l love
You ain't worth my love
If you only love to hate me
Love to hate me you hate to love me
I'm takin back what you've taken from me
You're mistaken honey this something that
Remind me why I be alone on my own
If I needed you I'd have you
That I know Hold up
I could do bad by myself don't need help
One of a kind the hand
That I was dealt like oh well
Felt Cupid was stupid
I should have knew it
Cause I been through it
You wouldn't do it if it ain't foolish stupid
애써서 활짝 웃었던 날에
밤은 왜 더 어두울까
It keeps bringing me down down down
모두 너무 쉽게 내뱉던 말
아마 들리겠지 머지않아
I've heard enough I've heard enough
Of the things that I'm not
온 세상이 바뀌어가도
아직 나는 그대론 걸
내가 걸어가는 이 길을 꿈꾸던
그때 그대로
그때 그대로
내 매일을 춤추던
처음 그 자리에 남아 있는 걸
But you'll never know unless
you walk in my shoes
You'll never know 엉켜버린 내 끈
'Cause everybody sees
What they wanna see
It's easier to judge me than to believe
깊이 숨겼던 낡은 생각들
가끔 나를 잡고 괴롭히지만
그럴수록 Imma shine baby
You know they ain't got a shot on me
Sunday night
I've been swallowed by my bed
I've been all over my head
Wonderin' if I gotta trying pretend
나도 잘 모르는 날
누가 알아주길 기대하는
내 모습을 찾을까 두려워
저 빛이 더 밝아질수록
내 그림자도 길어지는데
너무 눈이 부셔올 때
난 뒤를 볼 수 있을까
온 세상이 바뀌어가도
아직 나는 그대론 걸
내가 걸어가는 이 길을 꿈꾸던
그때 그대로
그때 그대로
내 매일을 춤추던
처음 그 자리에 남아 있는 걸
But you'll never know unless you
Walk in my shoes
You'll never know 엉켜버린 내 끈
'Cause everybody sees what they wanna see
It's easier to judge me than to believe
깊이 숨겼던 낡은 생각들
가끔 나를 잡고 괴롭히지만
그럴수록 Imma shine baby
You know they ain't got a shot on me
가라앉으면 안 돼
나도 잘 알아
땅만 보는 채론 날 수 없어
구름 건너편엔
아직 밝은 해
내가 그려왔던 그림 속에
찢어버린 곳들까지
다 비워내고 웃을 수 있게
보기 싫었던 나와 마주할래
난 기억해
So I'll be okay
파란 내 방 한가득 꽃이 피게
I'll always be waiting
But you'll never know unless
You walk in my shoes
You'll never know 엉켜버린 내 끈
'Cause everybody sees
What they wanna see
It's easier to judge me than to believe
깊이 숨겼던 낡은 생각들
가끔 나를 잡고 괴롭히지만
그럴수록 Imma shine baby
You know they ain't got a shot on me]",2021.06.11
44,20022492,BLACKPINK,65902003,Kill This Love (Japan Version),20104358,Kill This Love (Japan Version),[83],[],2019.10.16
45,20022492,BLACKPINK,65902004,Don't Know What To Do (Japan Version),20104358,Kill This Love (Japan Version),[46],[],2019.10.16
46,20022492,BLACKPINK,81517497,Lovesick Girls (Japan Version),982326,Lovesick Girls (Japan Version),[59],"[Lovesick girls
Lovesick girls
永遠にずっと
토와니 즛토
영원히 계속
出口閉ざしたままのlove (Love)
데구치 토자시타 마마노love(love)
나갈 곳 없는 love(love)
What can we say?
痛みに比例する Love (Love)
이타미니 히레이스루love(love)
아픔에 비례하는 love(love)
何を信じようが
나니오 신지요오가
무엇을 믿든
愛の傷にどんな意味もないと離れて
아이노 키즈니 돈나 이미모 나이토 하나레테
사랑의 상처엔 어떤 의미도 없어 헤어지면
ほら嫌気さすでしょ
호라 이야케사스데쇼
거 봐, 지겨워지지
決着どきよ 限界ねちょっと
켓챠쿠도키요 켕카이네 춋토
결정할 시간이야 이제 좀 한계야
痛みに期待 の せど
이타미니 키타이노세도
아픔에 기대해도
たかが一瞬だけどドア
타카가 잇슌다케도 도아
고작 한순간 뿐이지만 문을
何を探し彷徨うのか
나니오 사가시 사마요우노카
무엇을 찾아 헤매는지
But I don't care I'll do it over and over
あたしたち永遠に一緒ね
아타시타치 에이엔니 잇쇼네
우리는 영원히 함께야
We are the lovesick girls
ねぇ勝手に終わらせないよずっと
이타미오 싯테 와카루 이미와 킷토
아픔을 알고 이해하는 의미는 분명
We are the lovesick girls
痛みを知って分かる意味はきっと
But we were born to be alone
Yeah we were born to be alone
Yeah we were born to be alone
But why we still looking for love?
No love letters no X and O's
No love never my exes know
No diamond rings that set in stone
To the left better left alone
Didn't wanna be a princess I'm priceless
A prince not even on my list
Love is a drug that I quit
No doctor could help when I'm lovesick
たかが一瞬だけどドア
타카가 잇슌다케도 도아
고작 한순간 뿐이지만 문을
何を探し彷徨うのか
나니오 사가시 사마요우노카
무엇을 찾아 헤매는지
不安な目 はいたのが
후안나 메 하이타노가
불안한 눈을 뜬건
君だ痛くても永遠に一緒ね
키미다 이타쿠테모 에이엔니 잇쇼네
너애 아파도 영원히 함께야
We are the lovesick girls
ねぇ勝手に終わらせないよずっと
네에 캇테니 오와라세나이요 즛토
네 멋대로 끝낼 순 없어
We are the lovesick girls
痛みを知って分かる意味はきっと
이타미오 싯테  와카루 이미와 킷토
아픔을 일고 이해하는 의미는 분명
But we were born to be alone
Yeah we were born to be alone
Yeah we were born to be alone
But why we still looking for love?
愛は Slippin' and fallin'
아이와 Slippin' and fallin'
사랑은 Slippin' and fallin'
愛は Killin' your darlin'
아이와 Killin' your darlin'
사랑은 Killin' your darlin'
傷が癒えた後は全部忘れるほどに
키즈가 이에타 아토와 젠부 와스레루호도니
상처가 나은 후에는 전부 잊을 수 있을 정도로
聞こえないwhat you say
들리지 않아 what you say
痛みだけ幸せ
이타미다케 시아와세
고통만이 행복
悲しい目をする君の方が可哀想で
카나시이 메오스루 키미노 호오가 카와이소오데
슬픈 눈을 하고 있는 네가 더 불쌍해
We are the lovesick girls
ねぇ勝手に終わらせないよずっと
네에 캇테니 오와라세나이요 즛토
네 멋대로 끝낼 순 없어
We are the lovesick girls
痛みを知って分かる意味はきっと
이타미오 싯테 와카루 이미와 킷토
아픔을 알고 이해하는 의미는 분명
One two
(Lovesick girls) どうせ離れても
(Lovesick girls) 도오세 하나레테모
(Lovesick girls) 어차피 헤어져도
(Lovesick girls) 涙が枯れても
(Lovesick girls) 나미다가 카레테모
(Lovesick girls) 눈물이 말라도
(Lovesick girls) 痛みごまかしても
(Lovesick girls) 이타미 고마카시테모
(Lovesick girls) 아픔을 속여도
(Lovesick girls)
But we're still looking for love]",2021.07.13
47,20022492,BLACKPINK,82077312,Pretty Savage (Japan Version),20049444,Pretty Savage (Japan Version),[44],"[BLACKPINK in your area
BLACKPINK in your area
 
似てるようで　元が全然違う
Ah シャイだけど　敵はやっつけちゃう
Born skinny bitch 太ったって痩せてる
計算は苦手　勘は冴えてる
 
人気語ると　アゴ痛くなる
F boys not my boys サクサク カット
名前　ミスっちゃダメ DDU-DU DDU-DU 食らう
Drip drip ice it out bust it down top to the bottom
 
ブラックとピンクに
All up in it make it lit like
Yeah we some bitches you can't manage
難しいことchallenge
We some pretty pretty savage
We some pretty pretty savage
 
You better run run run
You better run run run
 
All my diamonds they yellow or bright white
Got 'em blind can't find me I'm outta sight
If you mad stay mad we not alike
S A V A G E keep it pretty pretty savage
 
似てる服でもStyleは違う
ジャーンと出たら　レッドカーペットをlayout
Blackとかpink とか　変化　させちゃう
嫉妬させるのは maybe I'm the problem
 
ブラックとピンクに
All up in it make it rain like
Yeah we some bishes you can't manage
難しいことchallenge
We some pretty pretty savage
We some pretty pretty savage
 
You better run run run
You better run run run
 
All my diamonds they yellow or bright white
Got 'em blind can't find me I'm outta sight
If you mad stay mad we not alike
S A V A G E keep it pretty pretty savage
 
Pretty girl
笑ってるからって　弱くはない
And I wish you would
雨風降るほど　高く飛べる
I got nothin' left to say to you
見せてあげるねattitude
言わなくてもいいかな? (You know)
 
Savage, 見るほど　かわいらしい
Savage, so pretty pretty pretty pretty
Savage, 見るほど　かわいらしい
Savage, so pretty pretty pretty pretty
]",2021.08.03
48,20022492,BLACKPINK,82019790,How You Like That (Japan Version),20334175,How You Like That (Japan Version),[32],"[ほら落ちるのずっと
底のないこの暗闇
伸ばした両手も
虚しさに降れただけ
この燦々の世界を Light up the sky
目に焼き付け I'll kiss you goodbye
消し差ってあげるその笑顔
ここから Hana dul ses
Ha how you like that?
You gon' like that that that that that
How you like that?
How you like that that that that that
Now look at you now look at me
Look at you now look at me
Look at you now look at me
How you like that?
Now look at you now look at me
Look at you now look at me
Look at you now look at me
How you like that?
Your girl need it all and that's a hundred
You can get it back when I don't want it
Karma come and get some
I got too much too much is just too enough
What's up? I'm right back
You need no right back
Plain Jane get hijacked
Don't like me? Then tell me how you like that
そう どんどんと世界を Shine like the stars
最高に良いよ I'll kiss you goodbye
消し差ってあげるその笑顔
ここから Hana dul ses
Ha how you like that?
You gon' like that that that that that
How you like that?
How you like that that that that that
Now look at you now look at me
Look at you now look at me
Look at you now look at me
How you like that?
Now look at you now look at me
Look at you now look at me
Look at you now look at me
How you like that?
この羽失った私を
あの闇に堕ちた私を
終わらせば良かったねそっと
Look up in the sky it's a bird it's a plane
Bring out your boss bish
BLACKPINK
How you like that?
You gon' like that
How you like that?]",2021.07.27
