,artist_id,artist_x,song_id,song_name,album_id,album,Like_Count,Lyric,date
0,20022492,BLACKPINK,6172716,Pink Venom,15902097,BORN PINK,"[3,814]","[Kick in the door Waving the coco 
팝콘이나 챙겨 껴들 생각 말고
I talk that talk Runways I walk walk 
눈 감고 pop pop 안 봐도 척 

One by one then Two by two
내 손끝 툭 하나에 다 무너지는 중
가짜 쇼 치곤 화려했지
Makes no sense 
You couldn't get a dollar outta me

자 오늘 밤이야 난 독을 품은 꽃
네 혼을 빼앗은 다음 Look what you made us do 

천천히 널 잠재울 FIRE 잔인할 만큼 아름다워 

I bring the pain like 

This that pink venom
This that pink venom
This that pink venom
Get 'em, get 'em, get 'em
Straight to ya dome like whoa whoa whoa 
Straight to ya dome like ah ah ah 

Taste that pink venom
Taste that pink venom
Taste that pink venom
Get 'em, get 'em, get 'em
Straight to ya dome like whoa whoa whoa 
Straight to ya dome like ah ah ah 

Black paint and ammo, got bodies like Rambo
Rest in peace, please light up a candle
This da life of a vandal, 
masked up and I'm still in Celine
Designer crimes or it wouldn't be me

Diamonds shinin' drive in silence 
I don't mind it I'm ridin' 
Flyin' private side by side 
with da pilot Up in the sky 
And I'm wildin', stylin' on them 
and there's no chance
Cuz we got bodies on bodies 
like this a slow dance 

자 오늘 밤이야 난 독을 품은 꽃
네 혼을 빼앗은 다음 Look what you made us do 

천천히 널 잠재울 FIRE 잔인할 만큼 아름다워 

I bring the pain like

This that pink venom
This that pink venom
This that pink venom
Get 'em, get 'em, get 'em
Straight to ya dome like whoa whoa whoa 
Straight to ya dome like ah ah ah 

Taste that pink venom
Taste that pink venom
Taste that pink venom
Get 'em, get 'em, get 'em
Straight to ya dome like whoa whoa whoa 
Straight to ya dome like ah ah ah 

원한다면 provoke us
감당 못해 and you know this

이미 퍼져버린 shot that potion 
네 눈앞은 핑크빛 ocean

Come and give me all the smoke 
도 아니면 모 like I'm so rock and roll 

Come and give me all the smoke 
다 줄 세워 봐 자 STOP DROP

I bring the pain like

La tatata La tatata La tatata La tatata 
La tatata La tatata 

Straight to ya
Straight to ya
Straight to ya dome like

La tatata La tatata La tatata La tatata
La tatata La tatata

I bring the pain like ]",2022.09.16
1,20022492,BLACKPINK,6176179,Shut Down,15902097,BORN PINK,"[3,293]","[Blackpink in your area
Blackpink in your area

컴백이 아냐 떠난 적 없으니까
고개들이 돌아 진정해 목 꺾일라
분홍빛의 얼음 drip drip drip freeze 'em on sight
Shut it down what what what what

게임이 아냐 진 적이 없으니까
짖어봐 네 목에 목줄은 내 거니까
땅바닥에 닿은 pedal we go two zero five 
Shut it down uh uh uh uh

초록 비를 내려 머리 위로 Don't trip, baby
겸손하게 그냥 앉아있어 Just sit, baby

Praying for my downfall, many have tried, baby
Catch me when you hear my Lamborghini go 
vroom, vroom, vroom, vroom

When we pull up you know it's a shutdown
간판 내리고 문 잠가 shut down
Whip it whip it whip it whip it
Whip it whip it whip it whip it
It's black and it's pink once the sun down

When we pull up you know it's a shutdown
간판 내리고 문 잠가 shut down
Whip it whip it whip it whip it 
Whip it whip it whip it whip it 
Keep watching me shut it down 

Nah
You don't wanna be on my bad side 
that's right I'm slidin' through
Bunch of wannabes that wanna be me, 
me three if I was you
Been around the world, pearls on ya girl, 
VVS's we invested uh
Need a lesson see the necklace, see these dresses 
We don't buy it we request it uh

A rockstar, a popstar but rowdier
Say bye to the paparazzi, get my good side, 
I'll smile for ya
Know it ain't fair to ya, 
it's scarin' ya like what now
Blackpink in your area, the area been shut down. 
It's a shutdown

네 다음 답안지야 똑바로 봐 don't sleep baby
뒤집어봐 이건 가격표야 ain't cheap baby

Stay in your own lane 'cause I'm 'bout to swerve
Catch me when you hear my Lamborghini go 
vroom, vroom, vroom, vroom

When we pull up you know it's a shutdown
간판 내리고 문 잠가 shut down

Whip it whip it whip it whip it
Whip it whip it whip it whip it

It's black and it's pink once the sun down

When we pull up you know it's a shutdown
간판 내리고 문 잠가 shut down

Whip it whip it whip it whip it 
Whip it whip it whip it whip it 

Keep watching me shut it down

Shut it down Blackpink in your area
Shut it down woah woah woah woah
Shut it down Blackpink in your area
Keep talking we shut you down]",2022.09.16
2,20022492,BLACKPINK,6176185,Ready For Love,15902097,BORN PINK,"[1,203]","[오늘 하루도 내 머릿속은 오직 Y-O-U
Can't get you out of my head
밤새 비워낸 병의 색은 BLUE

Yeah, 넌 도대체 몇 번을 
내 맘 가져다 버린 건지 몰라
생각의 기차는 쉬지 않고 달려가 밤새 못 자

Yeah, 넌 아쉬울 때만 Yeah, 그저 아쉬울 때만 날
Yeah, 그래 아쉬울 때라도 너라면 좋으니까

이젠 기다릴 것도 없잖아
겁낼 필요도 없잖아
네 심장의 색깔을 보여줘

정말 내 세상엔 네가 필요해
두 눈을 떠봐 네 앞에 Here I am

I'm ready for love

Tell me when you're ready
Cuz I'm already ready
Tell me when you're ready
Cuz 

I'm ready for love
I'm ready for love I'm ready for love
I'm ready for love
I'm ready for love

Ready or not, here I come and I'm running
Like it's now or never, I never know if you want it
What if love wasn't what it was supposed to be?
What if there's no Romeo for me?
No hope, no roses, no more notes to read
So I keep my eyes closed to see
What I need is forever and forever baby, 
not sometimes
When you want it then you best come find me 
cuz I‘m ready

이젠 기다릴 것도 없잖아
겁낼 필요도 없잖아
네 심장의 색깔을 보여줘

정말 내 세상엔 네가 필요해 
두 눈을 떠봐 네 앞에 Here I am

I'm ready for love

Tell me when you're ready
Cuz I'm already ready
Tell me when you're ready
Cuz

I'm ready for love
I'm ready for love I'm ready for love
I'm ready for love
I'm ready for love

네 영혼과 모든 것이
날 황홀하게 해 기뻐 웃게 해
나쁠 거 없잖아

네 모든 걸 날 위해 던질 때
널 지켜줄게

Lalala lalalala Lalala lalalala
Lalala lalalala Lalala lalalala]",2022.09.16
3,20022492,BLACKPINK,6176181,Yeah Yeah Yeah,15902097,BORN PINK,[938],"[나 왜 이래
자꾸만 웃음이나
넌 몰라 내가 왜 이러는지

말도 안 돼 난 너에게
끌려 버렸어
너의 무심한 말투에
빠져버린 내가 우스워

넌 왜 나타나서
뭔데 자꾸 생각나

혹시 나 좋아하면
말해

Just say yeah yeah yeah

Just say yeah yeah yeah

또 왜 이래
나도 날 모르겠어
아이 몰라 애매모호한 내 맘

말도 안 되는 너와 나의 첫 만남
이건 누군가 쓴 각본
우연이기엔 좀 수상해

넌 왜 나타나서
뭔데 자꾸 생각나
 
혹시 나 좋아하면
말해

Just say yeah yeah yeah

Just say yeah yeah yeah

사실 난 좀 두렵기도 해
또 한 번 더 사랑에 나 아플까

운명이 던진 질문 앞에 
don't you say no oh oh oh

Just say yeah yeah yeah

Say yeah yeah yeah

Say yeah yeah yeah

Say yeah yeah yeah]",2022.09.16
4,20022492,BLACKPINK,6176182,[19금],15902097,BORN PINK,"[1,165]",[],2022.09.16
5,20022492,BLACKPINK,6176180,[19금],15902097,BORN PINK,[675],[],2022.09.16
6,20022492,BLACKPINK,6176183,The Happiest Girl,15902097,BORN PINK,[636],"[Don't hold my hand 
Don't beg me back
Don't say that we'll make it through this
If I'm so beautiful then why

The doors we slammed
The plates we smashed
Echo with the sound of madness
I can't remember why we try

My heart only wants you
The moment you say no

But tonight I'll be the happiest girl in the world
You'll see like it doesn't matter
Tonight I'll be the happiest girl in the world
You'll see like it never happened

I can stop the tears if I want to
I can stop the tears if I want to
I can stop the tears if I want to

But tonight I'll be the happiest girl in the world
You'll see like it never happened

Don't make us saints 
We're wards of pain
The past and a perfect picture
There's no one else to blame this time

Don't change the truth 
We can't undo the high 
we chase steal the crash no
You're not the one, who gets to cry

My heart only wants you
The moment you say no

But tonight I'll be the happiest girl in the world
You'll see like it doesn't matter
Tonight I'll be the happiest girl in the world
You'll see like it never happened

I can stop the tears if I want to
I can stop the tears if I want to
I can stop the tears if I want to

But tonight I'll be the happiest girl in the world
You'll see like it never happened

All it takes is a smooth pop of a bottle top 
to fix a heart 
A broken heart baby

All it takes is a little rolling paper 
take us to the start
Go back to the start

But tonight I'll be the happiest girl in the world
You'll see like it doesn't matter
Tonight I'll be the happiest girl in the world
You'll see like it never happened

I can stop the tears if I want to
I can stop the tears if I want to
I can stop the tears if I want to

But tonight I'll be the happiest girl in the world
You'll see like it never happened]",2022.09.16
7,20022492,BLACKPINK,6176184,[19금],15902097,BORN PINK,[494],[],2022.09.16
8,20022492,BLACKPINK,30436007,불장난,15886617,SQUARE TWO,"[18,095]","[우리 엄만 매일 내게 말했어
언제나 남자 조심하라고
사랑은 마치 불장난 같아서 
다치니까 Eh

엄마 말이 꼭 맞을지도 몰라 
널 보면 내 맘이 뜨겁게 달아올라
두려움보단 널 향한 끌림이 더 크니까 Eh

멈출 수 없는 이 떨림은
On and on and on
내 전부를 너란 세상에
다 던지고 싶어

Look at me look at me now
이렇게 넌 날 애태우고 있잖아
끌 수 없어 

우리 사랑은 불장난

My love is on fire
Now burn baby burn
불장난
My love is on fire
So don’t play with me boy
불장난

Oh no 난 이미 멀리 와버렸는걸
어느새 이 모든 게 장난이 아닌 걸

사랑이란 빨간 불씨
불어라 바람 더 커져가는 불길
이게 약인지 독인지 우리 엄마도 몰라 
내 맘 도둑인데 왜 경찰도 몰라

불 붙은 내 심장에 더 부어라 너란 기름		
kiss him will I diss him I don’t know but I miss him
중독을 넘어선 이 사랑은 crack
내 심장의 색깔은 black

멈출 수 없는 이 떨림은
On and on and on
내 전부를 너란 불길 속으로
던지고 싶어

Look at me look at me now
이렇게 넌 날 애태우고 있잖아
끌 수 없어 

우리 사랑은 불장난

My love is on fire
Now burn baby burn
불장난
My love is on fire
So don’t play with me boy
불장난

걷잡을 수가 없는 걸
너무나 빨리 퍼져 가는 이 불길

이런 날 멈추지 마
이 사랑이 오늘 밤을 태워버리게 whooo]",2016.11.01
9,20022492,BLACKPINK,30436008,STAY,15886617,SQUARE TWO,"[9,401]","[툭하면 거친 말들로 내 맘에 상처를 내놓고
미안하단 말 한마디 없이 또 나 혼자 위로하고
오늘 하루도 혹시 날 떠날까 늘 불안해 해
I just want you to stay
점점 무뎌져 가는 너의 그 무표정 속에
천천히 내려놓자며 거울에 속삭이곤 해
날 당연하게 생각하는 너지만 그게 너다워
그래도 stay stay stay with me
널 닮은 듯한 슬픈 멜로디
이렇게 날 울리는데 eh eh 
네 향기는 달콤한 felony
너무 밉지만 사랑해

어두운 밤이 날 가두기 전에 
내 곁을 떠나지마
아직 날 사랑하니
내 맘과 같다면 오늘은 떠나지마
굳이 너여야만 하는 이유는 묻지마
그저 내 곁에 stay with me
(It goes a little something like)
 지금 당장 많은 걸 바라는 게 아냐
그저 내 곁에 stay with me

사실은 난 더 바라는 게 없어 이제
심장은 뛰긴 하는 건지 무감각해 그래
사람들과의 억지스런 한마디보단 
너와의 어색한 침묵이 차라리 좋아
So stay 그게 어디가 됐건 말이야
가끔 어둠이 올 때면 I’ll be your fire
거짓 같은 세상 속 유일한 truth it’s you
This a letter from me to you
널 닮은 듯한 슬픈 멜로디
이렇게 날 울리는데 eh eh
네 향기는 달콤한 felony
너무 밉지만 사랑해

어두운 밤이 날 가두기 전에 
내 곁을 떠나지마
아직 날 사랑하니
내 맘과 같다면 오늘은 떠나지마
굳이 너여야만 하는 이유는 묻지마
그저 내 곁에 stay with me
(It goes a little something like)
지금 당장 많은걸 바라는 게 아냐
그저 내 곁에 stay with me
(It goes a little something like)
지금 당장 많은걸 바라는 게 아냐
그저 내 곁에 stay with me]",2016.11.01
10,20022492,BLACKPINK,30436009,휘파람 (Acoustic Ver.),15886617,SQUARE TWO,"[2,241]","[Hey boy
Make' em whistle like a missile bomb bomb
Every time I show up blow up (uh)
Make' em whistle like a missile bomb bomb
Every time I show up blow up (uh)
넌 너무 아름다워
널 잊을 수가 없어
그 눈빛이 아직 나를
이렇게 설레게 해 boom boom
24 365
낮에도 이 밤에도
이렇게 너를 원해 ooh ooh
모든 남자들이 날 매일 check out
대부분이 날 가질 수 있다 착각
절대 많은 걸 원치 않아 맘을 원해 난
넌 심장을 도려내 보여봐
아주 씩씩하게 때론 chic chic 하게
So hot so hot 내가 어쩔 줄 모르게 해
나지막이 불러줘 
내 귓가에 도는 휘파람처럼

이대로 지나치지 마요
너도 나처럼 날 잊을 수가 없다면 WHOA
널 향한 이 마음은 Fire
내 심장이 빠르게 뛰잖아
점점 가까이 들리잖아

휘파람
UH 휘 파람 파람 파람 (can you hear that)
휘 파라파라 파라 밤
휘파람
UH 휘 파람 파람 파람 (can you hear that)
휘 파라파라 파라 밤

Hold up
아무 말 하지 마
Just whistle to my heart
그 소리가 지금 나를
이렇게 설레게 해 boom boom
생각은 지루해
느낌이 shhh!
Every day all day
내 곁에만 있어줘 zoom zoom
Uh 언제나 난 stylin'
도도하지만 네 앞에선 darlin'
뜨거워지잖아 like a desert island
너 알아갈수록 울려대는 마음속 
그만 내빼 넘어와라 내게 boy 이젠 checkmate
게임은 내가 win (uh-huh)
난 널 택해 안아줘 더 세게 누가 널 가로 
채 가기 전에 내가 (uh)
이대로 지나치지 마요
너도 나처럼 날 잊을 수가 없다면 WHOA
널 향한 이 마음은 Fire
내 심장이 빠르게 뛰잖아
점점 가까이 들리잖아

휘파람
UH 휘 파람 파람 파람 (can you hear that)
휘 파라파라 파라 밤
휘파람
UH 휘 파람 파람 파람 (can you hear that)
휘 파라파라 파라 밤

This beat got me feelin' like

바람처럼 스쳐가는
흔한 인연이 아니길

많은 말은 필요 없어
지금 너의 곁에
나를 데려가 줘 ohh 
Make' em whistle like a missile bomb bomb
Every time I show up blow up (uh)
Make' em whistle like a missile bomb bomb
Every time I show up blow up (uh)]",2016.11.01
11,20022492,BLACKPINK,30695454,마지막처럼,14143287,마지막처럼,"[17,648]","[너 뭔데 자꾸 생각나
자존심 상해 애가 타
얼굴이 뜨겁고 가슴은 계속 뛰어
내 몸이 맘대로 안 돼 어지러워

넌 한 줌의 모래 같아
잡힐 듯 잡히지 않아
넌 쉽지 않은 걸 그래서 더 끌려
내 맘이 맘대로 안 돼 어이없어

지금 너를 원하는 내 숨결이 느껴지니
널 바라보고 있어도 missing you
서툰 날 won’t you set me free

Baby 날 터질 것처럼 안아줘
그만 생각해 뭐가 그리 어려워

거짓말처럼 키스해줘 내가 너에게
마지막 사랑인 것처럼

마지막처럼 마-마-마지막처럼
마지막 밤인 것처럼 love
마지막처럼 마-마-마지막처럼
내일 따윈 없는 것처럼

Uh I'ma fall in love baby
You gon finna catch me
Uh give you all of this baby
Call me pretty and nasty
Cause we gonna get it my love you can bet it on 
black we gon double the stack on them whoa!
I be the Bonnie and you be my Clyde 
We ride or die  
Xs and Os

시간은 흘러가는데 마음만 급해지지
내 세상은 너 하나만 missing you
서툰 날 won’t you set me free

Baby 날 터질 것처럼 안아줘
그만 생각해 뭐가 그리 어려워

거짓말처럼 키스해줘 내가 너에게
마지막 사랑인 것처럼

마지막처럼 마-마-마지막처럼
마지막 밤인 것처럼 love
마지막처럼 마-마-마지막처럼
내일 따윈 없는 것처럼

One two three 새로운 시작이야
절대 뒤돌아보진 않을 거니까

날 너에게 던지면 너는 날 꼭 잡아줘
세상은 우릴 꺾지 못할 테니까

BLACKPINK in your area

Baby 날 터질 것처럼 안아줘
그만 생각해 뭐가 그리 어려워

거짓말처럼 키스해줘 내가 너에게
마지막 사랑인 것처럼

마지막처럼 마-마-마지막처럼
마지막 밤인 것처럼 love
마지막처럼 마-마-마지막처럼
내일 따윈 없는 것처럼 love]",2017.06.22
12,20022492,BLACKPINK,32031230,Lovesick Girls,15902090,THE ALBUM,"[9,518]","[영원한 밤
창문 없는 방에 우릴 가둔 love
What can we say
매번 아파도 외치는 love

다치고 망가져도 나
뭘 믿고 버티는 거야
어차피 떠나면 상처투성인 채로 미워하게 될걸
끝장을 보기 전 끝낼 순 없어
이 아픔을 기다린 것처럼

아마 다 잠깐 일지도 몰라
우린 무얼 찾아서 헤매는 걸까

But I don’t care I’ll do it over and over
내 세상 속엔 너만 있으면 돼

We are the lovesick girls
네 멋대로 내 사랑을 끝낼순 없어
We are the lovesick girls
이 아픔 없인 난 아무 의미가 없어

But we were born to be alone
Yeah we were born to be alone
Yeah we were born to be alone 
But why we still looking for love

No love letters, no x and o’s
No love never, my exes know
No diamond rings, that set in stone
To the left, better left alone

Didn’t wanna be a princess, I’m priceless
A prince not even on my list
Love is a drug that I quit
No doctor could help when I’m lovesick

아마 다 잠깐 일지도 몰라
우린 무얼 찾아서 헤매는 걸까

불안한 내 눈빛 속에 널 담아
아프더라도 너만 있으면 돼

We are the lovesick girls
네 멋대로 내 사랑을 끝낼 순 없어
We are the lovesick girls
이 아픔 없인 난 아무 의미가 없어

But we were born to be alone
Yeah we were born to be alone
Yeah we were born to be alone 
But why we still looking for love

사랑은 slippin’ and fallin’
사랑은 killin’ your darlin’
아프다 아물면 또 찾아오는 이 겁 없는 떨림

들리지 않아 what you say
이 아픔이 난 행복해
나를 불쌍해 하는 네가 내 눈엔 더 불쌍해

We are the lovesick girls
네 멋대로 내 사랑을 끝낼 순 없어
We are the lovesick girls
이 아픔없인 난 아무 의미가 없어

Lovesick girls 
모두 결국 떠나가고
Lovesick girls
내 눈물이 무뎌져도
Lovesick girls
아프고 또 아파도
Lovesick girls
But we’re still looking for love]",2020.10.02
13,20022492,BLACKPINK,32031228,Pretty Savage,15902090,THE ALBUM,"[3,735]","[비슷한 것 같지 우린 뼛속까지 다름
아이 창피하다가도 멍석 깔면 바름
Born skinny bish 암만 살쪄도 난 마름
계산은 느려도 눈치는 빠름

인기를 논하자면 안 해 입만 아픔
F boys not my boys 싹둑싹둑 자름
우리 이름 틀린다면 뚜두뚜두 맞음
Drip drip ice it out bust it down top to the bottom

검은색 분홍빛이
All up in it make it lit like
Yeah we some bishes you can’t manage
또 이 어려운 걸 해내지
우린 예쁘장한 savage 
We some 예쁘장한 savage

You better run run run
You better run run run

All my diamonds they yellow or bright white
Got’em blind can’t find me I’m outta sight
If you mad stay mad we not alike
S A V A G E keep it pretty pretty savage

비슷한 걸 걸쳤지만 자태부터 다름
짠 하고 나타나면 카펫부터 깔음
Black 했다 Pink 했다 내 맘대로 바꿈
네 질투가 문제야 maybe I’m the problem

검은색 분홍빛이
All up in it make it rain like
Yeah we some bishes you can’t manage
또 이 어려운 걸 해내지
우린 예쁘장한 savage 
We some 예쁘장한 savage

You better run run run
You better run run run

All my diamonds they yellow or bright white
Got’em blind can’t find me I’m outta sight
If you mad stay mad we not alike
S A V A G E keep it pretty pretty savage

Pretty girl
웃어주지만 마냥 약하진 않아
And I wish you would 
비바람이 불수록 더 높이 날아
I got nothin’ left to say to you
원하면 보여줄게 attitude
굳이 말 안 해도 다 알잖아 (You know)

Savage 봐도 봐도 예쁘장한 
Savage so pretty pretty pretty pretty
Savage 봐도 봐도 예쁘장한 
Savage so pretty pretty pretty pretty]",2020.10.02
14,20022492,BLACKPINK,32031229,Bet You Wanna (Feat. Cardi B),15902090,THE ALBUM,"[3,103]","[BLACKPINK
Cardi

Tell me where you wanna go
I’ll meet you with my bags at the door

(Ah I’m gon’ make you go blind
Every time I walk my hips they don’t lie)

Take me to your paradise
‘Cause I don’t wanna wait anymore

(Ah I’ll say it one more time
Every time I walk my hips they don’t lie)

You wanna touch wanna touch
Of course you wanna
You wanna run with my love
I know you wanna
From the club to the tub
You said you wanna
Give me an all night hug I bet you wanna

I bet you wanna
I bet you wanna
I bet you
I bet you
I bet you wanna, I bet you wanna, I bet you wanna

Something bout me’s takin you higher
And you ain’t ever gonna come down
(You ain’t ever, you ain’t ever)

I’m lighting your fire
And it ain’t ever gonna go out
(It ain’t ever, it ain’t ever)

Take the car keys 
Drive me crazy
Cardi a good catch 
But you gotta chase me
Grab my waist line but don’t ever waste me
Turn on please me but don’t ever play me 
One of a kind
You can’t replace me 
Time to shine I bust down the AP
The stakes is higher
Let’s do what we both desire
On god like I’m in the choir
I bet you if you make me sweat I’ll still be on fire

You wanna touch wanna touch
Of course you wanna
You wanna run with my love
I know you wanna
From the club to the tub
You said you wanna
Give me an all night hug I bet you wanna

I bet you wanna
I bet you wanna
I bet you
I bet you
I bet you wanna, I bet you wanna, I bet you wanna

Something bout me’s takin you higher
And you ain’t ever gonna come down
(You ain’t ever, you ain’t ever)

I’m lighting your fire
And it ain’t never gonna go out
(It ain’t ever, it ain’t ever)

If you want me 
Better bet higher
Wanna look down 
Up in the sky ahh
(Higher higher higher higher high
Boy better take it up so damn high)

Lookin so thick 
Make you desire
I’m a whole bit
Keep you up higher
(Higher higher higher higher high)

Something bout me’s taking you higher
And you ain’t ever gonna come down
(You ain’t ever, you ain’t ever)

I’m lighting your fire
And it ain’t ever gonna go out
(It ain’t ever, it ain’t ever)

Something bout me’s taking you higher
And you ain’t ever gonna come down
(You ain’t ever, you ain’t ever)

Bet you wanna love this ahhh]",2020.10.02
