,artist_id,artist_x,song_id,song_name,album_id,album,Like_Count,Lyric,date
42,80216536,여자친구(GFRIEND),31967971,Apple,20111263,回:Song of the Sirens,"[2,270]","[가시덤불 길 위에
짙게 남겨진 발자국은 핏빛
차가운 그 선택은
틀렸던 건지 왜 이렇게 아픈지
Ooh no 이 달콤한 향기와
반짝이는 루비 Drop 날 시험에 들게 해
Ooh no 자꾸 날 유혹해 봐 더
Yes 너의 향기 너의 빛깔
날 물들이는 Pleasure
Callin' me Callin' me Callin' me
내 안의 세계가 바스라져 내리네
반짝이는 Crystal
다가와 다가와 다가와
어느새 입술은 새빨간 널 탐하네
Come &amp; Dance with me
뜨거운 춤을 춘다 내 안에 별이 뜬다
투명한 유리구슬 붉게 빛나
뒤를 돌아보지 마 불안한 생각은 마
달콤한 어둠 아래 마녀들의 밤이 와
We O wow wow wow wow
We O ya ya ya ya
We O wow wow wow wow
내 회색빛 선택을 다 물들여 버릴 거야
어떤 것도 어떤 말도 날 멈출 수 없어
손가락과 입술 사이로 흐르는 붉은빛 물
어지러운 그 향기가 나를 이끌어
좋아 좋아 더 너무 좋은 걸
Callin' me Callin' me Callin' me
내 안의 세계가 바스라져 내리네
반짝이는 Crystal
다가와 다가와 다가와
어느새 입술은 새빨간 널 탐하네
Come &amp; Dance with me
뜨거운 춤을 춘다 내 안에 별이 뜬다
투명한 유리구슬 붉게 빛나
뒤를 돌아보지 마 불안한 생각은 마
달콤한 어둠 아래 마녀들의 밤이 와
We O wow wow wow wow
We O ya ya ya ya
We O wow wow wow wow
내 회색빛 선택을 다 물들여 버릴 거야
밤이 소란해질 때 더이상 돌이킬 수 없어
감히 그려온 축제의 막을 열어줘
새빨간 꿈을 꾼다 끝없이 파고든다
찬란한 파멸의 빛 날아올라
이제 고민하지 마 수줍은 아이는 놔
데려가 줘 영원히 마녀들의 밤이 와
We O wow wow wow wow
춤을 춘다 춤을 춘다
We O ya ya ya ya
별이 뜬다 별이 뜬다
We O wow wow wow wow
춤을 춘다 춤을 춘다
내 회색빛 선택을 다 물들여 버릴 거야]",2020.07.13
43,80216536,여자친구(GFRIEND),31967973,거울의 방,20111263,回:Song of the Sirens,[552],"[눈앞에 너의 모습을 도망치려 애써 봐도
또다시 마주쳐 우린
네 눈을 피해서 자꾸 움츠려 있어
모든 걸 함께 하고선
초라한 모습만 물고 뜯겨
지친 눈물들이 지겹게 나를 적셔
더는 보기 싫어
차마 미처 감춰지지 않아 억지로 외면해 난
내가 원한 건 이게 아니야
휘청이고 흔들리는 마음
다시 또 나를 만나
텅 빈 저 거울 속 너에게 달리고 또 달려가
홀린 듯 뒤돌아 날 탓해
너는 왜 갖질 못하는 거니 똑같은 표정인데
Run away for me
더는 내게 다가오지 마
불안으로 가득 채우지 나
네 개의 눈동자 그 속의 너와 나
그만 미워해도 돼
모든 게 지긋지긋해 사라져 가는 날 찾고 찾아
아픈 시간들이 끝없이 나를 가둬
더는 보기 싫어
차마 미처 감춰지지 않아 억지로 외면해 난
내가 원한 건 이게 아니야
휘청이고 흔들리는 마음
다시 또 나를 만나
텅 빈 저 거울 속 너에게 달리고 또 달려가
홀린 듯 뒤돌아 날 탓해
너는 왜 갖질 못하는 거니 똑같은 표정인데
Run away for me
아무도 없어 여긴 사방이 막혀
돌고 돌아 오직 나만이 널 사랑할 수 있어
텅 빈 저 거울 속 너에게 달리고 또 달려가
홀린 듯 뒤돌아 날 탓해
너는 왜 갖질 못하는 거니 똑같은 표정인데
Run away for me]",2020.07.13
44,80216536,여자친구(GFRIEND),31967972,눈의 시간,20111263,回:Song of the Sirens,[618],"[어딘지도 모른 채 달려왔던 거야 난
시간의 조각들이 나를 스쳐 지나가
한 걸음 걸음 두려움을 감추며
거센 바람 속 비틀거리며 걸어가
이 태풍 속 한 가운데로
멈추지 않을 파도라면 그 속으로
한 걸음 더
Let me out 보내 줘
Let me go 달려가
들려와 침묵의 외침이
Find the way
고요한 약속의 안식처
다시 나를 찾게 해줄
태풍 속의 눈의 시간이야
저 멀리 보여 투명한 내 조각들
눈 속에서 날 만났어 이제야
느껴지는 바람의 방향
잃어버렸던 나의 시간 쏟아져 와
날 일깨워
Let me out 보내 줘
Let me go 달려가
들려와 침묵의 외침이
Find the way
고요한 약속의 안식처
다시 나를 찾게 해줄
태풍 속의 눈의 시간
가만히 두 눈을 떴을 땐
짙은 온기가 날 감싸 안아주고
모든 아픈 기억마저
날 더 강하게 일으켜
용기 내 고개를 들고서
쉴 틈 없이 변해간대도
빛을 찾아 한 걸음씩
드디어 찾아낸 나만의 방향과 법칙들
흩어진 내 모든 기억들을 잡아
나의 시간 나의 노래 이젠 네게 들려줄게
날아가 Fly to you
너에게 I can go
바람을 거슬러 올라가
Find my way
견뎌낸 모든 날을 지나
나의 중심 나의 세계
너에게로 날아갈 거야
나의 길을 찾아갈 거야]",2020.07.13
45,80216536,여자친구(GFRIEND),31967974,Tarot Cards,20111263,回:Song of the Sirens,[477],"[Make a way Make a way
손끝 닿는 그곳에
펼쳐진 세상 그 설렘을 따라 가면 돼
아득하게 반짝이던 Better day Better day
손에 잡힐 듯 잡히지 않아 나만 더 초라해
한없이 수많은 길 수많은 밤
내가 선택했던 난 거친 세상 끝에서
작아져 셀 수 없이 Lose
One by one 펼쳐지는 카드 속 유혹해
내 마음을 흔들어 Tonight
Give me a give me a give me a sign
막연했던 모든 Question이
한 장씩 내게 속삭인
달콤한 목소리
떨린 발걸음을 Go ahead
다시 섞어 뒤집을 때마다 새로워질 Destiny
난 나만의 답을 찾아가
La la la la ta ta ta
La la la la ta ta
새롭게 펼친 Street
Good luck
La ta la ta ta ta ta ta
Make my tarot play
살며시 날 숨길래 Lock lock
바보같이 기대하지 않게
한없이 한없이 답은 멀리
잡히지 않아
One by one 펼쳐지는 카드 속 감춰진
너무 간절했던 단 하나
Give me a give me a give me a sign
내가 만들어 온 History
불안히 떨린 시선이
밤보다 더 멀리
사라져 간대도 Go ahead
다시 섞어 닿은 손끝마다 몰아치는 Destiny
난 또 다른 답을 찾아가
별 하나 없는 이 밤 자그마한 빛이라도
감춰졌던 다른 운명 속으로 One more
Shuffle 해봐
커져만 가 Mystery
더 알고 싶은 이야기
달콤한 목소리
떨린 발걸음을 Go ahead
다시 섞어 뒤집을 때마다 새로워질 Destiny
난 나만의 답을 찾아가
La la la la ta ta ta
La la la la ta ta
새롭게 펼친 Street
Good luck
La ta la ta ta ta ta ta
Make my tarot play]",2020.07.13
46,80216536,여자친구(GFRIEND),31821647,교차로 (Crossroads),20163624,回:LABYRINTH,"[2,108]","[펼쳐지는 Singing star
너에게 들려질까
시간이 끊어진
이 길에 서 있어
아직 믿어지지 않아
나 안일했던 거야
똑같이 바라봤는데
똑같이 헤맸는데 왜
내 맘이 다 무너져 버릴까
저 바람마저
널 아직 기다리며 서 있어
흩날리는 별빛도
서성이다
안돼 아직 모든 게 너로 가득해
아직 어디도 못 가겠어
너 혹시 빠르게 지나쳐도
내가 널 찾을게
그때 다시 너에게로
펼쳐지는 Singing star
너에게 들려질까
부서지는 Shining star
너에게도 보일까
어쩌면 이 노래가
널 다시 만나게 해줄 거라
짐작해 아니 침착해
난 아무것도 몰라
그리워하다 여전히
이곳에 멈춰있어 나
계속 맴돌기만 해
서성이다
안돼 아직 모든 게 너로 가득해
아직 어디도 못 가겠어
너 혹시 빠르게 지나쳐도
내가 널 찾을게
그때 다시 너에게로
너는 어디쯤에 가있는 걸까
Guide to the sky
어떤 길을 가도 다 너로 변해가
언젠가는 알게 될 거야
별빛을 따라서 달려갈게
널 기억 해낼게
그때 다시 너에게로
펼쳐지는 Singing star
너에게 들려질까
부서지는 Shining star
너에게도 보일까]",2020.02.03
47,80216536,여자친구(GFRIEND),31821646,Labyrinth,20163624,回:LABYRINTH,[893],"[멀리서 들려와 달콤한 속삭임
이리 와 Ah ah 저리 가 봐 Ah ah
Glitter in the air
주변의 반짝이는 모든 게
날 이끌어 대
빛을 따라 걸어 홀린 듯이
출구 없는 미로 속에서
Oh won't you wake up
Oh you'd better wake up
나를 따라 걷는 그림자가
소리쳐 날 삼키려 하네
Oh won't you wake up
Oh you'd better wake up
시끄러워 난 듣기 싫어
그저 이곳에 있고 싶어
꺼져버려
Hurricane이야 Hurricane이야
무서워 난 귀 막아
날 부르는 목소리 멀리 목소리
어서 깨어나 어서 깨어나
Break it now 벗어나
날 위해서라면 저 끝까지 갈래
사실은 알잖아 나는 곧 너인 걸
안 들려 Uh uh 듣기 싫어 Uh uh
거울 속 나를 봐봐
내 말 들어봐
Move your mind mind
Make it shine
뛰어넘어 힘껏 손을 뻗어
한 걸음 앞으로 나아가
Oh 제발 그만
Oh 제발 좀 그만
미로 속에 길을 잃고 있어
빛나는 가짜에 속지 마
Oh 제발 그만
Oh 제발 좀 그만
시끄러워도 제발 들어
빨리 이곳을 벗어나자
귀 막지 마
Hurricane이야 Hurricane이야
무서워 난 귀 막아
날 부르는 목소리 멀리 목소리
어서 깨어나 어서 깨어나
Break it now 벗어나
날 위해서라면 저 끝까지 갈래
저 끝까지 갈래
저 멀리 보이는 문을 지나
좀 더 거친 세상 어디론가
날아올라 봐
끝없이 몰려든 어둠은 다
불꽃처럼 타올라 줘
꺼져버려
Hurricane이야 Hurricane이야
무서워 난 귀 막아
날 부르는 목소리 멀리 목소리
어서 깨어나 어서 깨어나
Break it now 벗어나
날 위해서라면 저 끝까지 갈래]",2020.02.03
48,80216536,여자친구(GFRIEND),31821649,지금 만나러 갑니다 (Eclipse),20163624,回:LABYRINTH,[876],"[가고 있어 널 만나러
지금이 아니면 안 될 것 같아
다 온 것 같아 조금만 기다려 줘
내가 갈게
요즘 들어 많이 이상해 난
네 생각들로 눈물이 나
네게 뱉은 날 선 말들이
오히려 날 향해 돌아오나 봐
편해진 감정들이
짓궂게 심술부려
널 데려가
너무 늦지 않게 네게 말할게
미안해 지금 어디야 할 말이 있어
가고 있어 널 만나러
지금이 아니면 안 될 것 같아
다 온 것 같아 조금만 기다려 줘
내가 갈게
어둠 속에서 우리 둘만 빛나게
너의 따뜻한 그 빛을 머금고 싶어
멀리 돌아온 기적 같은 순간을
놓치지 않아 널 품에 안을게
한동안 네가 없던 날들
영원처럼 나에겐
느껴져 난 두려워
갈 곳을 잃어버린 아이처럼
너를 찾아 헤매고 있었나 봐
편해진 감정들이
짓궂게 심술부려
널 데려가
너무 늦지 않게 네게 말할게
미안해 지금 어디야 할 말이 있어
가고 있어 널 만나러
지금이 아니면 안 될 것 같아
다 온 것 같아 조금만 기다려 줘
내가 갈게
어둠 속에서 우리 둘만 빛나게
너의 따뜻한 그 빛을 머금고 싶어
멀리 돌아온 기적 같은 순간을
놓치지 않아 널 품에 안을게
길었던 기다림
두려웠던 마음도
서로의 온기가 닿은 순간에
모두 녹아내리게
가고 있어 널 만나러
지금이 아니면 안 될 것 같아
다 온 것 같아 조금만 기다려 줘
내가 갈게
어둠 속에서 우리 둘만 빛나게
너의 따뜻한 그 빛을 머금고 싶어
멀리 돌아온 기적 같은 순간을
놓치지 않아 널 품에 안을게]",2020.02.03
49,80216536,여자친구(GFRIEND),31833576,칵테일 사랑,20090302,투유프로젝트 - 슈가맨3 EPISODE.10,[384],"[마음 울적한 날엔 거리를 걸어보고
향기로운 칵테일에 취해도 보고
한 편의 시가 있는 전시회장도 가고
밤새도록 그리움에 편지 쓰고파
모차르트 피아노 협주곡 21번
그 음악을 내 귓가에 속삭여주며
아침 햇살 눈부시게 나를 깨워 줄
그런 연인이 내게 있으면
나는 아직 순수함을 느끼고 싶어
어느 작은 우체국 앞 계단에 앉아
프리지아 꽃향기를 내게 안겨 줄
그런 연인을 만나 봤으면
마음 울적한 날엔 거리를 걸어보고
향기로운 칵테일에 취해도 보고
한 편의 시가 있는 전시회장도 가고
밤새도록 그리움에 편지 쓰고파
모차르트 피아노 협주곡 21번
그 음악을 내 귓가에 속삭여주며
아침 햇살 눈부심에 나를 깨워 줄
그런 연인이 내게 있으면
나는 아직 순수함을 느끼고 싶어
어느 작은 우체국 앞 계단에 앉아
프리지아 꽃향기를 내게 안겨 줄
그런 연인을 만나 봤으면
마음 울적한 날엔 거리를 걸어보고
향기로운 칵테일에 취해도 보고
한 편의 시가 있는 전시회장도 가고
밤새도록 그리움에 편지 쓰고파
창밖에는 우울한 비가 내리고 있어
내 마음도 그 비 따라 우울해지네
누가 내게 눈부신 사랑을 가져 줄까
이 세상은 나로 인해 아름다운데
마음 울적한 날엔 거리를 걸어보고
향기로운 칵테일에 취해도 보고
한 편의 시가 있는 전시회장도 가고
밤새도록 그리움에 편지 쓰고파]",2020.02.15
